{
  "protocol": "ahp/1",
  "task_id": "demo-bridge-snapshot",
  "seq": 4,
  "event": "tool.pre",
  "class": "gate",
  "producer": {
    "name": "cc-cursor-bridge",
    "version": "ahp-adapter-draft",
    "host": {
      "name": "claude-code",
      "version": "2.1.306"
    }
  },
  "ts": "2026-10-22T01:27:05.487+08:00",
  "payload": {
    "tool_name": "Skill",
    "tool_use_id": "call_00_1mcUFIvftmAAHrO3Kvvb7763",
    "tool_input": {
      "skill": "superpowers:test-driven-development"
    }
  },
  "context": {
    "session_id": "c3233cdc-54f0-49fc-be19-21f5b86a66fd",
    "cwd": "/private/tmp/ccb-demo2-woqt",
    "transcript_path": "/Users/timon/.claude/projects/-private-tmp-ccb-demo2-woqt/c3233cdc-54f0-49fc-be19-21f5b86a66fd.jsonl",
    "prompt_id": "ae7e0386-efda-495b-b65e-70f711d9946c",
    "permission_mode": "acceptEdits"
  },
  "native": {
    "event": "PreToolUse"
  },
  "reply_file": "replies/4.json",
  "deadline": "2026-10-22T01:29:05.487+08:00",
  "timeout_ms": 120000,
  "decisions": [
    "allow",
    "deny",
    "ask"
  ],
  "default_decision": "deny"
}
