{
  "protocol": "ahp/1",
  "task_id": "demo-bridge-snapshot",
  "seq": 12,
  "event": "tool.post",
  "class": "notify",
  "producer": {
    "name": "cc-cursor-bridge",
    "version": "ahp-adapter-draft",
    "host": {
      "name": "claude-code",
      "version": "2.1.306"
    }
  },
  "ts": "2026-10-22T01:27:25.384+08:00",
  "payload": {
    "tool_name": "Write",
    "tool_use_id": "call_01_eLfqWXNes3GimjJ2FsMo2696",
    "tool_input": {
      "file_path": "/private/tmp/ccb-demo2-woqt/test_calc.py",
      "content": "import unittest\n\nfrom calc import add\n..."
    },
    "tool_response": {
      "text": "{\"type\": \"create\", \"filePath\": \"/private/tmp/ccb-demo2-woqt/test_calc.py\", \"content\": \"import unittest\\n\\nfrom calc import add\\n\\n\\nclass TestAdd(unittest.TestCase):\\n    def test_add_positive_integers(self):\\n        self.assertEqual(add(1…[truncated]",
      "truncated": true,
      "original_length": 626,
      "sha256": "4673a92a42bc3d6f02751515da2c0d3c79b6c892f2fa4d55eda315936987546e",
      "full_file": "push/12-tool.post.full.json"
    }
  },
  "context": {
    "session_id": "c3233cdc-54f0-49fc-be19-21f5b86a66fd",
    "cwd": "/private/tmp/ccb-demo2-woqt",
    "transcript_path": "/Users/timon/.claude/projects/-private-tmp-ccb-demo2-woqt/c3233cdc-54f0-49fc-be19-21f5b86a66fd.jsonl",
    "prompt_id": "ae7e0386-efda-495b-b65e-70f711d9946c",
    "permission_mode": "acceptEdits"
  },
  "native": {
    "event": "PostToolUse"
  },
  "truncated": true,
  "full_file": "push/12-tool.post.full.json"
}
