{
  "protocol": "ahp/1",
  "task_id": "demo-bridge-snapshot",
  "seq": 11,
  "event": "tool.pre",
  "class": "gate",
  "producer": {
    "name": "cc-cursor-bridge",
    "version": "9f478f8",
    "host": {
      "name": "claude-code"
    }
  },
  "ts": "2026-10-22T01:27:24.554+08:00",
  "payload": {
    "tool_name": "Write",
    "tool_input": {
      "file_path": "/private/tmp/ccb-demo2-woqt/test_calc.py",
      "content": "import unittest\n\nfrom calc import add\n\n\nclass TestAdd(unittest.TestCase):\n    def test_add_positive_integers(self):\n        self.assertEqual(add(1, 2), 3)\n\n    def test_add_negative_numbers(self):\n        self.assertEqual(add(-4, -6), -10)\n\n    def test_add_floats(self):\n        self.assertAlmostEqual(add(0.1, 0.2), 0.3)\n\n    def test_add_with_zero(self):\n        self.assertEqual(add(0, 5), 5)\n\n\nif __name__ == \"__main__\":\n    unittest.main()\n"
    },
    "tool_use_id": "call_01_eLfqWXNes3GimjJ2FsMo2696"
  },
  "context": {
    "session_id": "c3233cdc-54f0-49fc-be19-21f5b86a66fd",
    "cwd": "/private/tmp/ccb-demo2-woqt"
  },
  "native": {
    "event": "PreToolUse",
    "input_keys": [
      "cwd",
      "hook_event_name",
      "permission_mode",
      "prompt_id",
      "session_id",
      "tool_input",
      "tool_name",
      "tool_use_id",
      "transcript_path"
    ]
  },
  "reply_file": "replies/11.json",
  "deadline": "2026-10-22T01:29:24.554+08:00",
  "timeout_ms": 120000,
  "decisions": [
    "allow",
    "deny",
    "ask"
  ],
  "default_decision": "deny"
}
