{
  "protocol": "ahp/1",
  "task_id": "demo-bridge-snapshot",
  "seq": 7,
  "event": "tool.post",
  "class": "notify",
  "producer": {
    "name": "cc-cursor-bridge",
    "version": "9f478f8",
    "host": {
      "name": "claude-code"
    }
  },
  "ts": "2026-10-22T01:27:22.214+08:00",
  "payload": {
    "tool_name": "Bash",
    "tool_input": {
      "command": "ls -la /private/tmp/ccb-demo2-woqt",
      "description": "List files in working directory"
    },
    "tool_use_id": "call_00_ToeKLi3MtNFYIIvmidlO9164",
    "tool_response": "{\"stdout\": \"total 0\\ndrwx------    2 timon  wheel     64 Oct 22 01:26 .\\ndrwxrwxrwt  410 root   wheel  13120 Oct 22 01:27 ..\", \"stderr\": \"\", \"interrupted\": false, \"isImage\": false, \"noOutputExpected\": false}"
  },
  "context": {
    "session_id": "c3233cdc-54f0-49fc-be19-21f5b86a66fd",
    "cwd": "/private/tmp/ccb-demo2-woqt"
  },
  "native": {
    "event": "PostToolUse",
    "input_keys": [
      "cwd",
      "duration_ms",
      "hook_event_name",
      "permission_mode",
      "prompt_id",
      "session_id",
      "tool_input",
      "tool_name",
      "tool_response",
      "tool_use_id",
      "transcript_path"
    ]
  }
}
