{
  "protocol": "ahp/1",
  "task_id": "demo-bridge-snapshot",
  "seq": 12,
  "event": "tool.post",
  "class": "notify",
  "producer": {
    "name": "cc-cursor-bridge",
    "version": "9f478f8",
    "host": {
      "name": "claude-code"
    }
  },
  "ts": "2026-10-22T01:27:25.384+08:00",
  "payload": {
    "tool_name": "Write",
    "tool_input": {
      "file_path": "/private/tmp/ccb-demo2-woqt/test_calc.py",
      "content": "import unittest\n\nfrom calc import add\n\n\nclass TestAdd(unittest.TestCase):\n    def test_add_positive_integers(self):\n        self.assertEqual(add(1, 2), 3)\n\n    def test_add_negative_numbers(self):\n        self.assertEqual(add(-4, -6), -10)\n\n    def test_add_floats(self):\n        self.assertAlmostEqual(add(0.1, 0.2), 0.3)\n\n    def test_add_with_zero(self):\n        self.assertEqual(add(0, 5), 5)\n\n\nif __name__ == \"__main__\":\n    unittest.main()\n"
    },
    "tool_use_id": "call_01_eLfqWXNes3GimjJ2FsMo2696",
    "tool_response": {
      "text": "{\"type\": \"create\", \"filePath\": \"/private/tmp/ccb-demo2-woqt/test_calc.py\", \"content\": \"import unittest\\n\\nfrom calc import add\\n\\n\\nclass TestAdd(unittest.TestCase):\\n    def test_add_positive_integers(self):\\n        self.assertEqual(add(1…[truncated]",
      "truncated": true,
      "original_length": 626,
      "sha256": "4673a92a42bc3d6f02751515da2c0d3c79b6c892f2fa4d55eda315936987546e",
      "full_file": "push/12-tool.post.full.json"
    }
  },
  "context": {
    "session_id": "c3233cdc-54f0-49fc-be19-21f5b86a66fd",
    "cwd": "/private/tmp/ccb-demo2-woqt"
  },
  "native": {
    "event": "PostToolUse",
    "input_keys": [
      "cwd",
      "duration_ms",
      "hook_event_name",
      "permission_mode",
      "prompt_id",
      "session_id",
      "tool_input",
      "tool_name",
      "tool_response",
      "tool_use_id",
      "transcript_path"
    ]
  },
  "truncated": true,
  "full_file": "push/12-tool.post.full.json"
}
