{
  "protocol": "ahp/1",
  "task_id": "demo-bridge-snapshot",
  "seq": 2,
  "event": "prompt.submit",
  "class": "notify",
  "producer": {
    "name": "cc-cursor-bridge",
    "version": "9f478f8",
    "host": {
      "name": "claude-code"
    }
  },
  "ts": "2026-10-22T01:27:01.995+08:00",
  "payload": {},
  "context": {
    "session_id": "c3233cdc-54f0-49fc-be19-21f5b86a66fd",
    "cwd": "/private/tmp/ccb-demo2-woqt"
  },
  "native": {
    "event": "UserPromptSubmit",
    "input_keys": [
      "cwd",
      "hook_event_name",
      "permission_mode",
      "prompt",
      "prompt_id",
      "session_id",
      "transcript_path"
    ]
  }
}
