{
  "protocol": "ahp/1",
  "task_id": "demo-bridge-snapshot",
  "seq": 10,
  "event": "tool.post",
  "class": "notify",
  "producer": {
    "name": "cc-cursor-bridge",
    "version": "9f478f8",
    "host": {
      "name": "claude-code"
    }
  },
  "ts": "2026-10-22T01:27:24.161+08:00",
  "payload": {
    "tool_name": "Write",
    "tool_input": {
      "file_path": "/private/tmp/ccb-demo2-woqt/calc.py",
      "content": "def add(a, b):\n    return a + b\n"
    },
    "tool_use_id": "call_00_rAZx5kuyJBTmBmzF7YYC5654",
    "tool_response": "{\"type\": \"create\", \"filePath\": \"/private/tmp/ccb-demo2-woqt/calc.py\", \"content\": \"def add(a, b):\\n    return a + b\\n\", \"structuredPatch\": [], \"originalFile\": null, \"userModified\": false}"
  },
  "context": {
    "session_id": "c3233cdc-54f0-49fc-be19-21f5b86a66fd",
    "cwd": "/private/tmp/ccb-demo2-woqt"
  },
  "native": {
    "event": "PostToolUse",
    "input_keys": [
      "cwd",
      "duration_ms",
      "hook_event_name",
      "permission_mode",
      "prompt_id",
      "session_id",
      "tool_input",
      "tool_name",
      "tool_response",
      "tool_use_id",
      "transcript_path"
    ]
  }
}
