{
  "protocol": "ahp/1",
  "task_id": "demo-bridge-snapshot",
  "seq": 18,
  "event": "turn.stop",
  "class": "gate",
  "producer": {
    "name": "cc-cursor-bridge",
    "version": "9f478f8",
    "host": {
      "name": "claude-code"
    }
  },
  "ts": "2026-10-22T01:27:35.253+08:00",
  "payload": {
    "last_assistant_message": "`calc.py` 中实现了 `add(a, b)`，`test_calc.py` 用 `unittest` 覆盖了正整数、负数、浮点数和零值共 4 个用例。运行 `python3 -m unittest -v test_calc` 后 4 个用例全部通过（OK）。",
    "transcript_path": "/Users/timon/.claude/projects/-private-tmp-ccb-demo2-woqt/c3233cdc-54f0-49fc-be19-21f5b86a66fd.jsonl",
    "stop_active": false
  },
  "context": {
    "session_id": "c3233cdc-54f0-49fc-be19-21f5b86a66fd",
    "cwd": "/private/tmp/ccb-demo2-woqt",
    "transcript_path": "/Users/timon/.claude/projects/-private-tmp-ccb-demo2-woqt/c3233cdc-54f0-49fc-be19-21f5b86a66fd.jsonl"
  },
  "native": {
    "event": "Stop",
    "input_keys": [
      "background_tasks",
      "cwd",
      "hook_event_name",
      "last_assistant_message",
      "permission_mode",
      "prompt_id",
      "session_crons",
      "session_id",
      "stop_hook_active",
      "transcript_path"
    ]
  },
  "reply_file": "replies/18.json",
  "deadline": "2026-10-22T01:29:35.253+08:00",
  "timeout_ms": 120000,
  "decisions": [
    "ack",
    "block"
  ],
  "default_decision": "ack"
}
