{
  "protocol": "ahp/1",
  "task_id": "demo-bridge-snapshot",
  "seq": 1,
  "event": "session.start",
  "class": "notify",
  "producer": {
    "name": "cc-cursor-bridge",
    "version": "9f478f8",
    "host": {
      "name": "claude-code"
    }
  },
  "ts": "2026-10-22T01:26:59.904+08:00",
  "payload": {
    "source": "startup"
  },
  "context": {
    "session_id": "c3233cdc-54f0-49fc-be19-21f5b86a66fd",
    "cwd": "/private/tmp/ccb-demo2-woqt"
  },
  "native": {
    "event": "SessionStart",
    "input_keys": [
      "cwd",
      "hook_event_name",
      "session_id",
      "source",
      "transcript_path"
    ]
  }
}
