{
  "protocol": "ahp/1",
  "task_id": "demo-bridge-snapshot",
  "seq": 13,
  "event": "plan.update",
  "class": "notify",
  "producer": {
    "name": "cc-cursor-bridge",
    "version": "ahp-adapter-draft",
    "host": {
      "name": "claude-code",
      "version": "2.1.306"
    }
  },
  "ts": "2026-10-22T01:27:26.000+08:00",
  "payload": {
    "source": "TodoWrite",
    "items": [
      {
        "content": "写 calc.py 的 add",
        "status": "completed"
      },
      {
        "content": "写 test_calc.py 并跑通",
        "status": "in_progress"
      }
    ]
  },
  "context": {
    "session_id": "c3233cdc-54f0-49fc-be19-21f5b86a66fd",
    "cwd": "/private/tmp/ccb-demo2-woqt",
    "transcript_path": "/Users/timon/.claude/projects/-private-tmp-ccb-demo2-woqt/c3233cdc-54f0-49fc-be19-21f5b86a66fd.jsonl",
    "prompt_id": "ae7e0386-efda-495b-b65e-70f711d9946c",
    "permission_mode": "acceptEdits"
  },
  "native": {
    "event": "PostToolUse"
  }
}
